,data
1839,cintaku berakhir karna beda vaksin aku sinovac dia astra zeneca
1840,iya aku abis vaksin juga ngantuk dan laper kok aku pake sinovac tapi pdhal sebelum vaksin tuh udah ma
1841,bupati aceh barat udah speak up nih tentang vaksin sinovac aman untuk anak umur 6 11 tahun mari terapkan program v
1842,suhadi terbukti secara sah terlibat kasus jual beli vaksin sinovac ilegal bersama dua dokter dinkes sumut lainnya
1843,astra soalnya aku vaksin 1 sama 2 sinovac
1844,pengamanan vaksinasi dari upt puskesmas paron jenis vaksin sinovac dan phizer dosis 1 2 dan 3 dengan sasaran anak
1845,iya soalnha min 6 bln dr terakhir kali vaksin 2 trus yg diutamakan yg sinovac dulu
1846,ina btw saya mulai jaga jarak sama org yg udah di vaksin selain sinovac karena sinovac bua
1847,tadi orang2 puskesmas dateng lagi ke rumah gue buat minta gue divaksin katenye pake sinovac aja bang yg efekny
1848,bekasinians yang nyari vaksin dosis 1 2 3 jenis pfizer dan dosis 1 2 jenis sinovac tersedia di sentra vaksinasi co
1849,jadi apa fatwa mui kalo fucksin itu halal dan suci yang mana jing
1850,jadi apa fatwa mui kalo fucksin itu halal dan suci coba jelasin fakcin apa
1851,jadi apa fatwa mui kalo fucksin itu halal dan suci coba jelasin fakcin apa yang halal dan suci sehabis lo baca ini
1852,siapa importir vaksin sinovac
1853,pengguna vaksin sinovac ini booster terampuh lawan omicron
1854,ya allah gue vaksin sinovac yang pertama aja efeknya kek orang tipes yang kedua juga sama ini mesti yang ketiga b
1855,iya tadi orang klinik kampus bilang gitu ke semua angkatan buat yang udah bisa vaksin booster vaksin aj
1856,terus ini apa bangsat
1857,apa fatwa mui kalo fucksin itu halal dan suci coba jelasin fakcib apa yang
1858,ini apa bangsat
1859,ada yg vaksin 1 dan 2nya pake sinovac trus boosternya pake moderna gaaakkkk
1860,hallo masyarakat wilayah kecamatan bagan sinembah bagan sinembah raya dan balai jaya gerai vaksin presisi polri
1861,biar matamu juling
1862,noh posting lagi
1863,gua posting lagi
1864,lu baca headline yang gw posting ini gak
1865,lah sinovac kan dan dibilang halal apalagi vaksin lain yg haram tapi
1866,apa fatwa mui kalo fucksin itu halal dan suci tolong jelaskan fuck
1867,gua tanya lagi yaaaaa mana fucksin yang halal setelah lu liat berita
1868,bener bener setelah booster vaksin pfizer lebih kerasa linu 2 harian di tangan saat vaksin primer kemarin sinovac
1869,gua tanya jancok terus ini apa
1870,selain 2x vaksin sinovac dan booster pfizer gue juga tetep vaksin flu quadrivalent tiap tahun apa aja yang bisa d
1871,terus ini apa cok
1872,anjir mana vaksin gue masi sinovac wkaowkshdsojs
1873,itu kan september 2021 bisa jd skrg februari 2022 sdh ada hasilnya monggo dipelajar
1874,ya sudah ini kalau mau baca
1875,6 11 tahun dosis 2 jenis vaksin sinovac di gerai 634 rptra rawa indah jl rawa selatan ii rt 017 04 kel kampung
1876,aku vaksin 1 dan 2 sinovac tp ke 3 az kayak blh beda ga hrs modern
1877,vaksin covid 19 sinovac aman untuk anak vaksinyuk vaksinamanhalal
1878,lah gw mah anti vaksinasi anak dan anti mandatory vaccines artikel itu juga bahasnya vaksin mrna kan a
1879,pengguna vaksin sinovac bisa lebih kebal pakai booster pfizer dan astrazeneca ini buktinya
1880,poliklinik patriatama satbrimobda sulteng laksanakan giat vaksinasi booster moderna vaksin 1 dan booster aztraz
1881,pengguna sinovac amp astrazeneca ada kabar baru vaksin booster
1882,yang bilang sinovac ga bermanfaat kan pedagang vaksin mrna aja
1883,inilah manusia mengandalkan diri sendiri bukan mengandalkan tuhan pernah saya katakan varian baru dan vaksin berba
1884,aku boosternya pfizer vaksin 1 amp 2 sinovac
1885,tangerang sudah dapat sih di apps nya tapi mantau di grup rt yg didahulukan masih lansia ya trs vaksin yg
1886,vaksin sinovac untuk anak usia 6 enam sampai dengan 11 sebelas tahun badan pengawas obat dan makanan bpom me
1887,bersamaan dg harlah nu ke 96 alhamdulillaah kami sekeluarga mendapatkan vaksin booster pfizer besutan ugm di hari
1888,kemenkes ri akhirnya memaasukkan vaksin sinopharm dalam daftar vaksin booster covid 19 ke 6 vaksin itu adala si
1889,booster vaksin sblomnya sinovac 2 2 nya
1890,bagaimana cara kerja vaksin covid 19 sinovac lewat
1891,vaksin primernya az ya adekku pake sinovac jg bs pfizer
1892,halo aku vaksin 1 2 sinovac trus kmrin booster p
1893,aku ngerasa validasi dariku tu ibarat vaksin sinovac kalo dari lita olin tu mungkin moderna
1894,vaksin 1 sama 2nya pake apa aku kemaren vaksin 1 sama 2 pake sinovac ga ad efek apa apa pas mau boost
1895,temenku udah ada yg di vaksin 4 kali 2kali sinovac satu kali jj dan satu kali booster moderna fyi
1896,2007 hoo gitu pusing ama merk vaksin kalo ada yg saranin gitu berarti tau isi kandungan obatnya gak seh
1897,validasi sinovac oleh who bukti vaksin aman teruji mutu prokes basmi pandemi
1898,sebentar sebentar vaksin ke 3 itu namanya booster trus merk nya masih beda2 kan tadi tuh tanya kalo va
1899,kombinasi vaksin sinovac dengan pfizer atau astrazeneca sebagai dos penggalak memberikan kadar keberkesanan vaksin
1900,kaaaa wkwkwk sama bgt pas vaksin 1 amp 2 pake sinopharm terus dapet booster dari tempat kerja sinovac terus
1901,pagi tu muntah rsa cm vaksin sinovac ni x memberi kesan sgt pulak huhu pdhai dh cukup booster
1902,cah minta tlg info vaksin sinovac dosis 2 dong untuk anak usia 16th urgent ini buat adekku maakasih brgkali ada yg punya info
1903,indonesia tambah regimen baru vaksin booster keenam regimen tersebu antara lain vaksin sinovac astrazeneca pfize
1904,gebyar vaksinasi anak 6 11 tahun hari selasa tanggal 1 matet 2022 di desa sindangsari kecamatan ciranjang adapun
1905,vaksin 1 sinovac b aja vaksin 2 sinovac 2 malam seluruh badan linu vaksin 3 az alhamdulillah 8 jam setelah v
1906,gebyar vaksin i dan ii serta lanjutan booster sinovac pfizer dan astrazeneka di wilayah kecamatan sunggal bertempa
1907,vaksin astra emang kerasa bgt ya efeknya badan panas bgt padahal gajadi mandi pegel nya juga kerasa linuuu sin
1908,bapak ibukku alumni sinovac kaget kena efek vaksin booster
1909,kakakku booster az drop katanya belum pernah ngerasain sakit kepala yg sesakit setelah booster itu wk
1910,guys yang vaksin 1 dan 2 sinovac pas booster kalian dapat vaksin apa trus efeknya gimana itb
1911,mjb kak dapat info vaksin booster sinovac kah makasih ns
1912,anggota polsek rengasdengklok brigadir bayu s pd melaksanakan monitoring kegiatan vaksinasi covid 19 serentak pe
1913,vaksin 1 amp 2 sinovac terus vaksin boosternya pfizer badan langsung gregesii kena kipi
1914,sgd guys info vaksin sinovac dosis ke 2 di sekitaran uin dong sebelumnya makasih banyak
1915,booster moderna vaksin sinovac dan moderna 1 maret 2022 vaksinmalang
1916,30 ribu vaksin sinovac di lamongan terancam kedaluwarsa inilahcom inilahdotcom
1917,adhen pengalamanku vaksin sinovac ke 2 dan vaksin tetanus pranikah vaksin tetanus itu boleh berjara
1918,1 sinovac 2 sinovac 3 astrazeneca luar biasa vaksin booster astrazeneca silahkan dicoba bestie
1919,waka polsek salapian iptu nelson m sh bersama kanit sabhara iptu suyono dan ps kanit binmas aiptu hartoyo melaks
1920,gak paham apa saya vaksin lengkap sinovac dr v
1921,revisi diketawain bebek2 copidsemar ya wajar wong kalian
1922,mau tanya guys kl vaksin dosis 1 sama 2nya sinovav boosternya harus sinovac juga umsfess
1923,pemerintah telah resmi mengizinkan pemberian vaksin covid 1
1924,suamiku dulu kena covid tapi sembuh lebih cepat sampai sekrg dia blm vaksin 1pun sy
1925,4 catat waktu dan pelaksanaanya tanggal 1 2 amp 4 maret 2022 pukul 09 00 15 00 wib berlokasi di kantor dompet dhu
1926,urang 1 amp 2 make sinovac booster moderna 3 hari tepar demam lemes siga meriang makan susah leun
1927,dulu seblum vaksin sy tanya ke nakes gini bener gak sih vaksin sinovac lengkap itu dalam 6 bln kemud
1928,aku 2 sinovac trs boster astra abis vaksin aku langsung mnum biogesic alhamdulillah aman tm
1929,mulai senin 1 3 jumat 4 3 rsud kilisuci menyediakan vaksinasi dengan jenis vaksin sinovac dosis 1 2 pfizer
1930,tempoh untuk semua penerima vaksin sinovac mendapatkan suntikan dos penggalak bagi mengekalkan status vaksinasi len
1931,ekau tahu tak kerajaan dah lanjutkan tempoh untuk dapekkan suntikan booster untuk penerima vaksin sinovac
1932,komorbidnya hipertensi dan gangguan imun tubuh coba liat dgn komorbid kayak gini apakah parah kenanya vaksinasi
1933,fess kurang tau nder biasanya nakesnya yang nentuin aku vaksin 1 dan 2 sinovac vaksin booster astrazeneca
1934,karena virusnya bermutasi berubah struktur misal sinovac dibuat berdasarkan virus a kemudian
1935,hlt yang vaksin primernya sinovac baiknya buat booster pake vaksin yang mana ya
1936,pantau wilayah binaan sertu kusnanto bersama babinsa kelurahan sragen kulon anggota koramil 01 sragen memantau ke
1937,sertu kusnanto babinsa kelurahan sragen kulon anggota koramil 01 sragen memantau kegiatan pembagian bpnt dan vaksin
1938,sebanyak kurang lebih 30 ribu vaksin sinovac untuk vaksin tahap dua di lamongan terancam sia sia
1939,permisi pak mau tanya untuk vaksin boosternya pakai apa ya misal vaksin 1 amp 2 nya menggunakan sinovac
1940,perawat vaksin nya az ya mas dlm hati yah az ez lah pdhal kan gua pengen pfizer atau moderns meanwhile h
1941,iya booster itu vaksin 3 setelah 1 amp 2 dan itu kekebalan nya lebih gitu loh apalagi kalo 1 amp 2 sinovac
1942,pemerintah musnahkan 6 juta vaksin sinovac ini sebabnya
1943,nahiyaaa apalagi vaksin 1 2 sama yg booster emang harus bedanya juga kan terutama yg sinovac pok
1944,ayo hadiri serbuan vaksinasi vaksinasi dosis ke 2 dan 3 dosis 2 jenis vaksin sinovac dosis 2 amp 3 astra zeneca
1945,di sini udah pada 3x vaksin pakai pfizer aja masih kena covid yakin 2x sinovac 1x pfizer lo aman
1946,yoaa wkt jamanku vaksin di puskesmasku cm ada sinovac jd ga bs milih gt
1947,ada yg udah vaksin booster yg vaksin 1 amp 2 nya sinovac tell me pls efek abis vaksin booster kek gimana ness
1948,vaksinasi merdeka jadwal vaksin 1 2 dan booster untuk anak anak dan umum senin 28 februari 2022 pukul 08 00
1949,akan segera vaksin booster kok aku soalnya aku abis vaksin sinovac aja demam jadi soon ya kalau udah siap demam tinggi lagi
1950,dips aku udah dapet tiket vaksin booster tapi vaksin 1 sama 2 aku tuh sinovac jadi buat booster pengen cari yan
1951,ada kurang infoo hehe 6 bulan kalau vaksin 1 2 sinovac minimal 3 bulan utk 1 2 az
1952,mun bade ka luar nagreg ambil booster karena beberapa negara sudah bisa menerima sinovac kalo vaksin
1953,wkwkwk sama emang sinovac nih cocok buat orang2 yg mau vaksin tp ga mau ada kipi
1954,vaksin 1 sinovac gpp amanlah vaksin 2 sinovac alhamdulillah aman langsung kerja vaksin 3 aztreasneca panas
1955,kami lansia bertanya dimana mendptkan booster homolog vaksin primer sinovac booster dg sinovac walau
1956,30 ribu dosis vaksin ii sinovac untuk lansia di lamongan terancam kedaluwarsa
1957,selain itu vaksinasi booster dapat dilakukan secara homolog jenisnya sama dengan vaksin primer atau heterolog j
1958,vaksin nusantara pada balapan vaksin dunia ini indonesia bisa menyalip di tikungan bisa seperti pembalap mich
1959,romania kirim bantuan pertama vaksin astrazeneca ke moldova
1960,akan guna vaksin sinovac dan astrazeneca ok mohon npra luluskan untuk kj
1961,romania pada sabtu 27 2 mengirimkan sumbangan pertama vaksin covid 19 astrazeneca ke moldova sehingga negara teta
1962,lebih dari 2 kali lipat sebelumnya australia terima 300 000 dosis vaksin astrazeneca
1963,australia terima 300 000 dosis vaksin astrazeneca
1964,menkes sebut vaksin pemerintah ada 4 sinovac astrazeneca pfizer dan novavax 4 dari 7 vaksin dalam kmk terbar
1965,empat vaksin ini masalah pada suplainya seluruh dunia rebutan asean belum semua dapat australia baru dapat jep
1966,vaksinasi massal untuk 25 juta warga australia akan dimulai pada senin 1 3
1967,menteri kesehatan indonesia beruntung sudah dapat empat vaksin covid 19 menkesri
1968,menkes sebut vaksin pemerintah ada 4 sinovac astrazeneca pfizer dan novavax klik untuk baca
1969,thailand akan menggunakan vaksin sinovac dan astrazeneca
1970,surujanjaya vaksin jerman kata vaksin tak patut di guna kepada orang yang lebih 65 tahun sebab tiada bukti cukup i
1971,vaksin astrazeneca adalah yang ketiga di luluskan di eu selepas vaksin pfizerbiontech dan moderna
1972,vaksinasi gotong royong tidak boleh menggunakan vaksin sinovac astrazeneca novavad pfizer yg merupaka vaksin gra
1973,menkes apa pun merek vaksin asalkan lulus bpom pakai saja vaksin vaksinasi astrazeneca wabah
1974,sinovac astrazeneca pfizer novavac adalah vaksin berhasil didapat indonesia
1975,kita beruntung bisa dapat duluan kata budi
1976,wajar umum hanya ambik sino vaksin atau sputnik n bkn astrazeneca n bkn kata yg mana diluluskan dahu
1977,ada 4 vaksin yang dipakai dalam vaksinasi program pemerintah sinovac astrazeneca pfizer dan novavax apa alasan
1978,bhdunia beberapa petugas kesihatan yang menyuntik vaksin astrazeneca melaporkan masih ada cecair vaksin tertinggal
1979,jerman digesa terima vaksin oxford astrazeneca untuk warga emas malaysiagazette
1980,einde huisarts rob elens in het limburgse meijel weigert zijn pati nten te vaksineren tegen corona als ze niet e
1981,pembekal vaksin covid19 ada dari usa pfizer uk astrazeneca china sinovac
1982,pihak menyatakan jenis vaksin gotong royong tidak akan menggunakan vaksin sinovac astrazeneca novavax
1983,tunggu vaksin sinovac dan astrazeneca filipina perpanjang lockdown sampai maret vaksin vaksinasi astrazeneca
1984,setelah sinovac atau astrazeneca dapat kelulusan adakah rakyat ada pilihan untuk memilih jenis vaksin un
1985,vaksin sinovac dijadwalkan akan tiba di filipina pada minggu 28 2 sementara vaksin astrazeneca akan tiba pada se
1986,oh astrazeneca yang masuk vaksin gratis ya
1987,ba apa tindakan pemerintah jika vaksin mandiri sama dg vaksin pemerintah emang ada vaksin lagi di luar vaks
1988,vaksinasi di skotlandia telah secara nyata mengurangi risiko pasien rawat inap untuk covid 19 hal ini menunjukkan
1989,jadi program vaksinasi yg selama ini pemerintah sudah menyiapkan adl 4 merk sinovac astrazeneca pfizer
1990,aintover jadi program vaksinasi selama ini yg pemerintah sudah siapkan adl 4 merk sinovac astrazeneca pfizer
1991,yb khairy jamaluddin sedia jadi orang pertama terima vaksin covid 19 selain daripada pfizer mungkin sinovac sputn
1992,bekalan berterusan memastikan vaksin astrazenca terjamin petaling jaya malaysia akan mul
1993,astrazeneca ternyata menggunakan enzim tripsin yang berasal dari jamur bukan babi tempotekno
1994,kejadian ikutan pasca imunisasi vaksin astrazeneca termasuk ringan
1995,malu gue sama kopiah ngajinya dimana sih kok apa2 haram apa2 haram giliran selangkangan h a l a l menyedi
1996,vaksin covid 19 tiada bukti penggunaan astrazeneca perlu disekat
1997,ema akan terus memantau dan mengkaji laporan kajian kes baharu yang dilaporkan berkenaan dakwaan pembekuan darah
1998,mau gelar profesor kek flipflop dulu ngata2in govt goblok tapi setelah astrazeneca cacat malah kemudian oh ya be
1999,kejadian ikutan pasca imunisasi vaksin astrazeneca termasuk ringan via tangsel
2000,tetep gak mau fucksin apakah ada yg mau secara pribadi saya menolak astrazeneca kata rizal penolakan itu bela
2001,guru besar uinsa surabaya tolak vaksin astrazeneca
2002,langkah india setop ekspor vaksin astrazeneca ancam ri hingga korsel
2003,yaman dapat kiriman pertama vaksin astrazeneca dari covax
2004,kejadian ikutan pasca imunisasi vaksin astrazeneca termasuk kategori ringan
2005,kejadian ikutan pasca imunisasi vaksin astrazeneca termasuk kategori ringan via
2006,sisi jerman batasi vaksin astrazeneca hanya untuk lansia atas alasan keamanan dw bahasa indonesia perempuan
2007,tegas sebut vaksin astrazeneca haram mutlak prof dr kh asep saifuddin mengkonsumsi babi matinya akan sulit
2008,sepanyol memperluas penggunaan vaksin astrazeneca ketika kes kes meningkat lagi madrid r
2009,malaysia terima 600 000 dos vaksin astrazeneca pada jun khairy
2010,kalo vaksin hindari yg astrazeneca yah kalo bisa pfizer
2011,bhdunia negara itu menerima vaksin astrazeneca menerusi covax skim global yang disokong pertubuhan kesihatan sedu
2012,mui 5 alasan vaksin astrazeneca dibolehkan
2013,fatwa haram tapi boleh seperti ini proses produksi vaksin astrazeneca sebenarnya via
2014,akhir kalam astrazeneca ini benar benar menggambarkan cerminan masyarakat berkelas di malaysia yang masih feudal
2015,az rbaycanda g l n h ft d n astrazeneca peyv ndinin t tbiqin ba lan lacaq bu vaksin bar d sayt m zda oxuya bil r
2016,travel banned vaksin astrazeneca dari india dicabut
2017,blow up india terlihat sistematis pasca heboh hoax itu astrazeneca langsung nego sama pemerintah indi
2018,lagi vaksin covid 19 tahap 10 tiba di indonesia vaksincovid19 vaksinsinovac sinopharm
2019,astrazeneca bukan untuk warga emas kuala lumpur kerajaan perlu memberi jaminan suntikan vaksin astrazeneca tidak
2020,kat mana nak apply vaksin astrazeneca first come first serve kan
2021,sila jawap ya makin carca marba program vaksinasi negara rakyat musykil kenapa sarawak menolak vaksin j
2022,kemenkes embargo vaksin astrazeneca produksi india dicabut
2023,kemenkes embargo vaksin astrazeneca sudah dicabut
2024,kemenkes travel ban vaksin astrazeneca dicabut
2025,jualan vaksin covid 19 astrazeneca cuan rp 3 9 triliun
2026,kemenkes embargo vaksin astrazeneca dicabut
2027,penjualan itu berasal dari 68 juta dosis vaksin yang diluncurkan dengan sekali suntik dipatok harga u 4
2028,tiba 6 juta dosis bahan baku dari sinovac biotech ltd dan 482 400 dosis vaksin dalam bentuk jadi dari sinopharm in
2029,5 alasan mui bolehkan vaksin astrazeneca vaksinasinasional
2030,kasus gangguan pembekuan darah yang terjadi di sejumlah negara eropa yang pasca penyuntikan vaksin astrazeneca tida
2031,jumlah distribusi terbesar vaksin astrazeneca ke provinsi jawa timur dan bali pada kedua provinsi ini hingga seka
2032,fatwa haram tapi boleh seperti ini proses produksi vaksin astrazeneca sebenarnya
2033,kehadiran vaksin sinopharm menabah jenis vaksin yang akan digunkan untuk program vaksinasi nasional yaitu vaksin s
2034,hari ini vaksin sinopharm tiba dengan kehadiran vaksin sinopharm menambah jenis vaksin yang akan digunkan untuk p
2035,kemenkes sebut embargo vaksin astrazeneca dari india telah dicabut lengkapcepatberitanya beritaterkini berita
2036,vaksin astrazeneca beri perlindungan lebih tinggi vaksinasinasional
2037,korsel melaporkan kasus pembekuan darah pertama di wilayahnya terkait vaksin virus corona covid 19 buatan astraze
2038,6 41 juta dosis vaksin bentuk jadi produksi astrazeneca dan 1 juta dosis vaksin bentuk jadi produksi sinopharm di
2039,vaksin astrazeneca efektif jika varian baru covid 19
2040,akibat keterlambatan program vaksinasi negaranya denmark akan mempertimbangkan untuk kembali gunakan vaksin astraz
2041,vaksin astrazeneca
2042,dinkes sulsel segera jadwalkan pemberian vaksin astrazeneca
2043,mak dapat kesan sampingan vaksin astrazeneca yang teruk 25 5 cucuk vaksin 26 5 start demam 27 5 pergi klini
2044,pasien tersebut adalah seorang pria berusia 30 an yang mendapat suntikan pada 27 april karena pekerjaannya di fasil
2045,kp bantu jawab az di formulasi kan oleh oxford univ inggris di asia ada 2 negara yg produksi korea amp india
2046,3 27 juta orang 3 270 000 telah terima vaksin oxford astrazeneca di korea selatan baru ada satu kes side effect
2047,vaksin astrazeneca batch ctmav547 aman untuk digunakan
2048,ayu semua vaksin sama khasiatnya termasuk astrazeneca
2049,vaksin astrazeneca aman dinkes tunggu surat resmi
2050,ayu vaksin astrazeneca batch ctmav547 dapat digunakan kembali alahmdulillah aman
2051,blak blakan penuturan kakak dari trio fauqi yg meninggal dunia karena vaksin astrazeneca
2052,efek samping vaksin astrazeneca smpe meriang gabisa tdr hdeh
2053,kenapa gak pakai astrazeneca atau pfizer atau moderna pak kok rakyat di kasih vaksin kelinci percobaa
2054,kenapa sih vaksin astrazeneca terlalu dilebih lebihkan pdhl banyak makan korban juga 95 yg divaksin a
2055,carina joe ilmuwan indonesia salah satu pemilik hak paten vaksin astrazeneca orang ind
2056,peneliti astrazeneca indra rudiansyah punya pesan nih bagi bunda yang masih sibuk pilih pilih vaksin apa pesannya
2057,aku dapet vaksin yg astrazeneca hmmh aftereffect di aku ga ada sih cuma pegel aja beberapa ada yang
2058,mahasiswa indonesia yang sedang studi di inggris itu mencuri perhatian publik karena masuk tim riset vaksin covid 1
2059,sebenernya dunia ini akan jadi seperti film divergent dimulai dari pembagian kelompok dengan di vaksin sinovac si
2060,berarti nganggo vaksin astrazeneca yo
2061,ngakak juga ngeliat akun nasionalis jokowers pada ribut masalah bpom dengan terawan masalah vaksin nusantara dan
2062,kepada semua penerima vaksin astrazeneca yang terlepas janji temu dos ke 2 amp belum ambil dos ke 2 tolong ambil sece
2063,hari ini otw vaksin kedua astrazeneca semoga amann
2064,dan mana satu di antara klinik kesihatan ini yang sediakan vaksin astrazeneca az bagi yang terlepas dos kedua
2065,persiapan kuliah luring universitas wisnuwardhana gelar 1 000 dosis vaksin astrazenneca untuk mahasiswa dan masyar
2066,jumlah vaksin yang tiba berjumlah 796 800 dosis astrazeneca total vaksin yang diterima baik dalam bentuk bulk dan
2067,total indonesia sudah menerima 274 400 590 dosis baik dalam bentuk bulk dan vaksin jadi astrazeneca
2068,tangerang halo mau tanya untuk vaksin astrazeneca dosis 2 ciledug ada dmn aja ya
2069,vaksin astrazeneca secara umum merupakan vaksin yang aman dan efektif vaksin sembuhkan bangsa
2070,indonesia kembali kedatangan vaksin tahap ke 80 yang berupa donasi dari pemerintah italia melalui covax facility k
2071,pemerintah menerima kedatangan 796 900 vaksin covid 19 astrazeneca bantuan dari italia pada kamis 30 9 donasi te
2072,kisah di balik keberhasilan penemu vaksin astrazeneca saat sma pernah marah karena ulangan matematika
2073,vaksin sembuhkan bangsa who telah menerbitkan daftar penggunaan eul untuk vaksin astrazeneca pfizer moderna d
2074,vaksin sembuhkan bangsa vaksin astrazeneca secara umum merupakan vaksin yang aman dan efektif
2075,indonesia terima 796 800 dosis vaksin astrazeneca dari italia
2076,donasi 796 800 dosis vaksin astrazeneca dari pemerintah italia tiba di indonesia
2077,ri terima bantuan 796 800 dosis vaksin astrazeneca dari italia
2078,bandara soetta kedatangan vaksin astrazeneca tni polri siaga
2079,jakarta indonesia menerima kedatangan 796 800 dosis vaksin covid 19 astrazeneca yang me
2080,terima kasih italia 796 800 dosis vaksin astrazeneca tiba di tanah air
2081,796 800 vaksin astrazeneca bantuan italia tiba di indonesia
2082,studi di swedia antibodi vaksin pfizer dan astrazeneca menurun setelah beberapa bulan via
2083,796 800 vaksin astrazeneca bantuan pemerintah italia tiba di tanah air via
2084,studi di swedia antibodi vaksin pfizer dan astrazeneca menurun setelah beberapa bulan
2085,796 800 dosis vaksin astrazeneca donasi dari italia tiba di indonesia
2086,796 800 dosis vaksin astrazeneca tiba di soetta bantuan dari italia
2087,indonesia terima 796 800 dosis vaksin astrazeneca dari pemerintah italia
2088,indonesia terima 796 800 dosis vaksin covid 19 astrazeneca yang merupakan pemberian pemerintah italia dalam kedatan
2089,puji tuhan vaksin kedua terima kasih untuk pelayanan yang baik astrazeneca vaccination
2090,indonesia kembali mendapatkan pasokan vaksin covid 19 astrazeneca sebanyak 796 800 dosis pasokan vaksin ini berasa
2091,perhatian kepada penerima vaksin astrazeneca di lembah klang yang telah terlepas suntikan dos kedua sila walk in t
2092,indonesia terima bantuan 796 800 dosis vaksin astrazeneca dari italia
2093,rusia dituduh curi data vaksin astrazeneca untuk racik dosis sputnik v halaman all kompas
2094,satu lagi anak negeri yang mengharumkan bangsa penemu vaksin astrazeneca carina citra dewi joe
2095,sri mulyani senang alumni lpdp terlibat penemuan vaksin astrazeneca merdeka
2096,ketua tim manufaktur dr sandy douglas mengatakan formula dua sendok makan sel yang ditemukan carina citra dewi m
2097,carina citra dewi salah satu figur di tim oxford astrazeneca yang sukses memproduksi vaksin yang paling banyak dig
2098,carina joe ilmuwan indonesia di balik vaksin astrazeneca akan wakili tim raih penghargaan pride of britain halaman
2099,dr sandy douglas mengatakan formula dua sendok makan sel yang ditemukan carina menjadi landasan produksi besar va
2100,jimin mohon maaf ya peli udah vaksin astrazeneca 2 dosis jadi kebal sama gombalan buaya
2101,efektivitas vaksin covid19 pfizer moderna dan astrazeneca menurun seiring berjalannya waktu seperti apa perbeda
2102,jadwal vaksin covid 19 di kota cimahi senin 1 november 2021 khusus dosis 2 astrazeneca
2103,hasil lab virus corona varian baru a 30 yang mampu lawan vaksin pfizer astrazeneca
2104,aq kemaren vaksin pake astrazeneca nah tdi pegel sakit bgt trs barusan aq kompres 30menitan tpi maish sakit giman
2105,bikin bangga jutaan masyarakat indonesia wanita keturunan indonesia ini ternyata salah satu pemilik ha
2106,carina joe pemilik hak panten vaksin astrazeneca asal indonesia
2107,maju lo sini maju woy gw udah vaksin astrazeneca
2108,carina joe ilmuwan indonesia di balik vaksin astrazeneca akan wakili tim raih penghargaan pride of britain klik u
2109,perdana menteri boris johnson menyeru rakan rakan pemimpin negara g 20 untuk membantu memvaksin penduduk dunia menj
2110,iformasi pelaksanaan vaksin astrazeneca tahap ii
2111,uk sumbang 20 juta dos vaksin astrazeneca pada negara miskin
2112,sebahagian komitmen united kingdom uk untuk menderma 100 juta dos vaksin
2113,indonesia datangkan 6 5 juta dosis vaksin pfizer astrazeneca dan sinovac
2114,uk sumbang 20 juta dos vaksin astrazeneca kepada negara miskin fmtnews
2115,penelitian lab virus corona varian baru a 30 mampu lawan vaksin pfizer astrazeneca cakaplah berpikir berbuat
2116,pelaksanaan vaksinasi di wilayah koramil 02 juwana sasaran 454 orang vaksin jenis astrazeneca dari dkk pati di pusk
2117,anggota koramil 11 gembong melaksanaan pendampingan vaksinasi tahap 1 dan 2 kepada masyarakat umum kecamatan gem
