,data
1040,inilah 7 efek samping vaksin booster covid 19 apa saja covid19 selengkapnya klik link berikut
1041,penyebaran covid19 kini mulai meningkat kembali dgn varian baru yaitu omicron utk itu pemerintah mengeluarkan kmbl
1042,vaksin covid19 pandemic
1043,willy justru kalo peneliti pake darah dr napi pela
1044,mari dukung pemerintah dalam upaya melawan penyebaran covid 19 dengan cara menerapkan protokol kesehatan dalam ke
1045,manfaat dari vaksinasi covid 19 yaitu menurunkan angka penyebaran dan kematian akibat virus corona dan juga jika s
1046,vaksinasi massal covid 19 bagaikan reuni akbar insan pers pwi turut jaga rasa nyaman lewat ung
1047,india memasang target untuk memvaksinasi 300 juta warga dalam waktu 7 bulan saja the lancet menyebutnya kampanye v
1048,perlombaan mutasi dan vaksinasi covid 19
1049,presiden direktur pt bank central asia tbk bca jahja setiaatmadja membagikan tips kepada masyarakat yang ingin p
1050,pemkot bogor gelar vaksinasi covid 19 tahap 2 mulai 1 maret vaksinasi vaksin kotabogor
1051,pemkot bogor melakukan vaksinasi covid 19 tahap kedua mulai senin 1 maret 2021 vaksinasi massal dilakukan di 8 t
1052,harapan covid di indonesia 3m semakin disiplin vaksinasi 70 tiba tiba kelar kaya war of the world
1053,menkes vaksinasi covid 19 mandiri bukan untuk tujuan bisnis
1054,wujudkan indonesia bebas covid 19 dgn vaksinasi vaksinuntukrakyatindonesia vaksinuntukkebaikan
1055,yuk bantu lawan covid 19 dengan vaksinasi vaksinuntukrakyatindonesia vaksinuntukkebaikan
1056,ayoo kita dukung percepatan vaksinasi nasional menuju indonesia bebas covid 19
1057,nasihat sebelum menghadiri program vaksinasi covid 19 sumber jabatan kesihatan negeri johor komunikasikita
1058,menjadi contoh warga babinsa yapen timur laksanakan vaksinasi covid 19 via
1059,proses pendaftaran vaksinasi melalui mysejahtera dalam 5 langkah mudah layari dan klik b
1060,indonesia jadi salah satu negara yang sejak awal tahun telah menggelar vaksinasi covid 19 dorongpemulihannkri
1061,tentu ini akan menjadi saat yang paling penting bagi usaha untuk memutus mata rantai covid vaksinasi serentak jela
1062,penyuntikan vaksin covid 19 tahap ii diawali dengan pekan vaksinasi
1063,pengamat program vaksinasi covid mesti dimanfaatkan masyarakat
1064,akhirnya ada kabar baik mengenai vaksinasi covid 19 lalu bagaimana seharusnya gereja bersikap simak di sini dala
1065,kota bogor lakukan vaksinasi corona tahap dua terbaru aktual berita live
1066,muncul indikasi vaksinasi efektif tekan jumlah pasien covid 19
1067,gubernur bali ajak masyarakat dukung program vaksinasi covid 19
1068,asli chaidir berharap masyarakat sukseskan program vaksinasi covid 19
1069,prangko vaksinasi covid 19 penanda kesigapan perangi pandemi
1070,berikut ini update data vaksinasi covid 19 di jawa timur sampai dengan 28 februari 2021 tetap patuhi protokol kes
1071,begini cara lansia daftar vaksinasi corona terbaru berita live nusantara
1072,begini cara lansia daftar vaksinasi covid 19 anda bisa mendaftar melalui link ba
1073,kepala dinas kesehatan kota bogor sri nowo retno penyuntikan vaksin covid 19 produksi bio farma itu akan dilakukan
1074,kepala dinas pendidikan sumatera selatan riza fahlevi mengatakan hingga kini pihaknya belum menyetujui kegiatan b
1075,vaksinasi covid 19 guru bagaimana dengan murid
1076,tebang pilih vaksinasi covid 19 bagi tahanan korupsi dan kroco via
1077,140 pkl malioboro yogyakarta ragu vaksinasi covid 19 ini kata satgas
1078,jumlah harian penerima vaksinasi covid 19 pada 28 februari 2021
1079,dengan vaksinasi massal semoga indonesia dapat melalui pandemi covid ini dan kembali bangkit sukseskan vaksinasi
1080,untuk memberikan pelayanan terbaik kepada pelanggan di masa pandemi pln mendukung program vaksinasi covid 19 pemer
1081,yuk jangan takut dan ragu untuk vaksinasi covid 19 karena vaksin covid 19 itu aman dan halal guys kamu jangan ta
1082,saya mengajak seluruh komponen bangsa untuk mendukung langkah langkah pemerintah mengatasi pandemi termasuk dengan
1083,dinkes kepri vaksinasi belum tentu bisa hentikan penyebaran covid 19
1084,para personel polsek kauditan di vaksinasi covid 19
1085,kebut vaksinasi bio farma tambah fasilitas produksi vaksin covid 19
1086,16 juta dosis bahan baku vaksin covid 19 dari perusahaan sinovac tiba di indonesia sore ini dengan begitu indon
1087,total 8 095 717 orang telah jalani vaksinasi covid 19 antara news jawa barat
1088,ya itu pak saya jg berpikiran nantinya akan dilanjutkan program
1089,target vaksinasi 5 juta guru dinilai aman untuk memulai kembali proses sekolah tatap muka juli mendatang namun pro
1090,penambahan fasilitas produksi vaksin covid 19 ini untuk membantu memenuhi kebutuhan serta percepatan program vaksin
1091,pasti sahabatpengayoman semarang apa kata teman teman di upt tentang program vaksinasi covid 19 ini
1092,kipi jatuh akibat astrazeneca satgas sulut suspend vaksinasi covid
1093,pasti sahabatpengayoman semarang jangan unggah sertifikat vaksinasi covid 19 kamu di media sosial yaa
1094,lindungi keluarga dan diri sendiri dengan melaksanakan vaksinasi covid 19
1095,terus dukung vaksinasi covid 19 untuk menuju indonesia sehat divhumaspolri humaspoldantb humaspolreslobar
1096,vaksinasi di kabupaten tasikmalaya dilakukan malam dan pagi hari selama ramadan vaksinasi covid 19 akan tetap dila
1097,vaksinasi covid 19 prioritaskan pasien gagal ginjal via online
1098,wta mendesak petenis segera vaksinasi covid 19
1099,kampus perguruan tinggi di as jadi pusat vaksinasi covid 19 via
1100,vaksinasi covid 19 untuk lansia bekasi wacanakan jemput bola
1101,saat ini kabupaten sumbawa barat ksb berada pada zonasi kuning sehingga forkopimda dan seluruh stakeholder berusa
1102,anggaran program vaksinasi covid 19 capai rp130 03 triliun
1103,tinjau vaksinasi di palembang mendagri tito ajak masyarakat tak ragu divaksin covid 19
1104,perkembangan data kasus dan juga vaksinasi corona di jakarta per 31 maret 2021 terbaru berita live terkini
1105,jangan takut dan ragu untuk vaksinasi covid 19 ayo bersama kita putus mata rantai penyebaran covid 19
1106,ayo vaksinasi covid 19 jangan takut dan jangan ragu polri
1107,update vaksinasi covid 19 smoga lancar amin tbk
1108,bupati kolaka jalani vaksinasi covid 19 tahap kedua
1109,vaksin covid 19 vaksinasi di australia berjalan lamban apa sebabnya
1110,vaksinasi corona bentuk perlindungan kepada lansia dari risiko kesakitan dan juga kematian terbaru berita bisnis
1111,pemerintah indonesia masih terus menjalankan program vaksinasi covid 19 di seluruh wilayah indonesia
1112,kami akan memberikan vaksinasi kepada 1 000 pekerja sebagai bentuk merayakan hari buruh meskipun dalam kondisi p
1113,bayang bayang diskriminasi di balik paspor vaksinasi covid 19
1114,iik perhutani lembang bersama sespimpolri sukseskan vaksinasi covid 19
1115,yuk kita sama sama sukseskan program vaksinasi covid 19 dan tetap disiplin protokol kesehatan memakai masker menj
1116,ababil yg ada nambah semprat semprot tes covid berkala vaksinasi beli lisensi zoom ac lampu li
1117,provinsi2 di sumatera mengalami kenaikan kasus positif covid 19 sebaiknya segera ikuti program vaksinasi dan taa
1118,udah tau vaksinasi rendah kenapa juga malah test nya rendah penanganan covid selagi gak ngurusin pencegahan pe
1119,case kyk gini yg butuh kesigapan pemerintah pusat dan daerah untuk bantu segera minimal biaya pengobatannya ditang
1120,199 karyawan gota supermarket jalani vaksinasi covid 19 dosis pertama
1121,vaksin covid 19 sinopharm mendapat lampu hijau di indonesia untuk digunakan dalam skema vaksinasi swasta
1122,update proses penyuntikan vaksin covid 19 di tanah air
1123,kemajuan vaksinasi covid 19 di indonesia tanggal 01 mei 2021 vaksinasi tahap 1 30 79 vaksinas
1124,28 413 perusahaan mendaftar vaksinasi covid 19 optimisbangkitkannegeri
1125,vaksinasi membantu kita mencegah dari penularan covid 19 optimisbangkitkannegeri
1126,vaksinasi covid 19 di indonesia sentuh angka 27 juta suntikan
1127,telah terima vaksinasi asisten perekonomian dan keuangan dki terkonfirmasi covid 19
1128,pendamping dua pra lansia dapat kesempatan vaksin
1129,pemerintahan presiden mendatangkan 8 juta dosis bahan baku vaksin sinovac tahap ke 14 yang tiba di banda
1130,26 85 juta dosis vaksin covid 19 sudah digunakan untuk vaksinasi nasional
1131,ketua umum kamar dagang dan industri mengatakan bahwa ada 28 413 perusahaan mendaftar vaksinasi covid 19 gotong roy
1132,hingga saat ini realisasi pelaksanaan vaksinasi covid 19 program pemerintah telah mencapai total 26 9 juta dosis
1133,pmerintah terus berupaya keras untuk menghadirkan vaksin covid 19 dalam rangka memenuhi kebutuhan vaksinasi di indo
1134,hingga saat ini sudah tercatat sebanyak 28 413 perusahaan yang mendaftar untuk mengikuti kegiatan vaksinasi covid 1
1135,pemerintah terus menghadirkan vaksin covid 19 dalam rangka memenuhi kebutuhan vaksinasi di indonesia upaya tersebu
1136,jumlah stok vaksin covid 19 di indonesia saat ini mencapai sektiar 20 juta
1137,pusat vaksinasi terbesar di england dibuka england membuka pusat vaksin covid 19
1138,bhabinkamtibmas polsek sebangau bersama ppkm mkro sambangi vaksinasi covid 19 di rsud kota palangka raya
1139,vaksinasi covid 19 untuk warga dunia di daerah terpencil
1140,masak yg 2x sdh divaksin lantas tetap kena covid dan meninggal juga ada tuh al
1141,kita sempat menyentuh angka 90 ribuan kasus aktif covid sekarang sudah kembali masuk ke 100 ribuan tolong jaga 3m
1142,repost jangan takut di vaksin ayo para lansia kita ikuti vaksinasi covid 19 dukunggermas
1143,gibran klaim pengendalian covid di solo lebih baik dibanding kota lain di jateng menurut gibran pasca hari raya i
1144,kemajuan vaksinasi covid 19 di indonesia tanggal 01 juni 2021 vaksinasi tahap 1 41 04 vaksina
1145,pak kapan kami pekerja tower selular dapat kesempatan untuk vaksin covid pak kami setiap hari dari kot
1146,vaksinasi covid 19 dapat diberikan kepada ibu hamil ibu menyusui dengan pengawalan oleh dokter baik sebelum maupun
1147,500 kader ampi sumut ikut vaksinasi david ini bentuk dukungan kepada pemerintah cegah penyebaran covid 19
1148,semoga membantu
1149,banyaknya cakupan vaksinasi juga mulai dikembangkan kepada ibu hamil sebagai usaha dalam melindungi populasi ibu ha
1150,giat vaksinasi tak hanya mall bsb balikpapan jubir satgas covid beber lokasinya tribun kaltim
1151,sertu sugeng bersama perangkat desa gemantar melaksanakan pemantauan kegiatan vaksinasi covid di desa gemantar juma
1152,kemenkes kebut vaksinasi covid 19 perluas pos pelayanan dan menghapus syarat ktp domisili
1153,negeri informasi yang kami dapatkan kuota vaksinasi adalah 50 penumpang per hari informasi mengenai kartu
1154,polda jateng mendirikan gerai vaksinasi presisi tersebar di seluruh jawa tengah dalam rangka menyambut hari bhaya
1155,vaksinasi massal covid 19 gowa ayo daftar sukseskan 1 juta vaksin per hari info gowa
1156,tahun publisherstory utm source kummobile amp utm medium twitter amp utm campaign share amp shareid
1157,tni membantu pemerintah dengan mengerahkan nakes sebanyak mungkin agar herd immunity segera terbentuk guna memutus
1158,vaksinasi covid 19 di polda metro jaya polres dan lokasi lain di jakarta nih
1159,panewu sanden drs bangun rahina mm sedang memantau kegiatan vaksinasi covid 19 di kalurahan srigading sanden rab
1160,pemerintah terus mempercepat pelaksanaan vaksinasi covid 19 nasional untuk mengejar target yang telah ditetapkan y
1161,bupati instruksikan dinkes tapteng meningkatkan sinergitas pelaksanaan vaksinasi massal covid 19
1162,mari selalu disiplin protokol kesehatan dan melaksanakan vaksinasi untuk menghindar covid 19 jadi menyebar di negar
1163,kasus covid klaster vaksinasi here we go soon
1164,presiden jokowi menegaskan bahwa ppkm darurat hanya berlaku untuk semua wilayah di pulau jawa dan bali di 6 provin
1165,gelombang pertama covid taun lalu di kantor cuma kontak sama komputer dan kertas sekarang di gelombang kedua yg a
1166,pingin mengakhiri pandemi covid 19 di rumah aja udah pake masker keluar rumah juga udah rajin cuci tangan juga u
1167,selamat datang bulan agustus sobat mari berjuang berjuang bersama hadapi pandemi covid 19 tetap jaga protokol k
1168,gubernur dki jakarta anies baswedan menegaskan bahwa layanan vaksinasi covid 19 di ibu kota akan terus berlanjut me
1169,dan ini data perkembangan vaksinasi di indonesia per 25 juga 2021 sumber
1170,bnpt bantu percepatan vaksinasi covid 19 di kabupaten poso sulteng berjuang lawan pandemi
1171,tolong dengar suara sy covid sudah 1th lebih di desa sy vaksinasi baru 1kali itu jg bln juli 2021 den
1172,diduga dipaksa vaksinasi covid 19 warga berpenyakit bawaan di boalemo kena stroke pihak puskesmas tetap haruskan
1173,dari total 7 5 juta vaksin covid 19 dosis pertama di ibu kota kurang lebih 40 persennya merupakan warga ber ktp lu
1174,fecho pak dpd dpc dan dpp ngadain vaksinasi covid 19 gratis napa si
1175,bakti menjaga keselamatan masyarakat mari bersama berkontribusi mencega
1176,komunitas golf bersama shgc sukses gelar vaksinasi massal covid 19 sindonews bukanberitabiasa
1177,lantamal ambon gelar vaksinasi covid 19 di atas kapal perang
1178,polri akan tindak tegas penyebar hoax terkait vaksinasi covid 19 berjuang lawan pandemi
1179,khoz solihin gp dan puluhan sesepuh jabar sudah ikut vaksinasi
1180,4 fakta target vaksinasi covid 19 60 juta vaksin tiba lagi bulan ini vvaksinasi
1181,kunci menghentikan pandemi adalah kepatuhan kita bersama melakukan prokes 5m amp vaksinasi covid 19 sesegera mungkin
1182,menteri bumn apresiasi gerakan antar rakyat gelar sentra vaksinasi covid erickthohir
1183,bukti vaksinasi covid 19 akan jadi salah satu syarat dalam pelonggaran berbagai aktivitas publik di dki jakarta
1184,lembah klang hampir dengan 100 vaksinasi dos pertama petaling jaya lemb
1185,mari kita ambil peran dalam perang lawan covid 19 siapkan maskermu kuatkan imunmu bersana kita basmi pandemi
1186,sebanyak 1 100 mahasiswa di bekasi menerima vaksinasi covid 19 vaksinasi digelar di aula universitas bhayangkara j
1187,polri akan tindak tegas penyebar hoax terkait vaksinasi covid 19
1188,mahfud md perlu dukungan pimpinan agama percepat vaksinasi covid 19
1189,kerajaangagal senang tutup parlimen walaupun semua sudah vaksinasi gaji dia orang tetap jalan lagi tu
1190,ini apa kalo bukan pemaksaan namanya masih banyak contoh pemaksaan vaksin kepada orang yang komorbid k
1191,lokasi vaksinasi covid 19 gratis di polres dan polsek tangsel cek syaratnya jakarta
1192,ini keluhan setelah vaksinasi covid 19
1193,asor cek dg puskesmas setempat mulai minggu lalu sdh ada vaksinasi covid 19 untuk bumil
1194,ade yasin yang juga ketua satgas covid 19 kabupaten bogor mengatakan 32 305 guru di wilayah tersebut wajib vaksin
1195,jmsi sumsel paguyuban sinar mas dan keluarga rimbawa gelar vaksinasi covid 19 diikuti 1 000 orang di palembang via
1196,covid 19 belum berlalu ambil pelajaran dari negara lain mereka abaikan protokol kesehatan kuncinya adalah vaksin
1197,pemerintah kota depok mengadakan gebyar vaksinasi serentak di 11 kecamatan mulai hari ini rabu 1 september 2021
1198,menkes berharap program vaksinasi masyarakat kaki gunung dapat diperluas ke daerah lain untuk menekan laju penulara
1199,kecamatan air besar laksanakan vaksinasi covid 19 moderna bupati karolin vaksinasi harus tepat sasaran
1200,cirebon pemerintah kota cirebon melaksanakan program gebyar vaksinasi covid 19 masyarakat yang belum mendapatkan
1201,indonesia peringkat ke 4 vaksinasi covid 19 dunia
1202,vaksinasi memakai vaksin astrazeneca dan pfizer
1203,hallo sobata let s check it out video dokumentasi pelaksanaa vaksinasi covid 19 dosis 2 di sma negeri 5 semarang
1204,vaksin cansino dan sinovac akan digunakan untuk meningkatkan vaksinasi di enam negeri yang belum mencapai
1205,kepada masyarakat se kec tejakula dalam rangka program percepatan vaksinasi covid 19 kami jajaran polres bulele
1206,sambil wisata bisa sambil ikutan di vaksin salah satunya di sini jabar
1207,jika setelah mendapat vaksinasi covid 19 kemudian hamil maka vaksinasi kedua tetap dilanjutkan setelah usia kehamilan 13 minggu
1208,salut semangat semuanya masyarakat mendukung upaya pemerintah mengakhiri pandemi covid indonesia vaksin for
1209,ayo datang dan sukseskan vaksinasi covid 19 untuk menciptakan herd immuniti hari senin tanggal 06 september 2021 be
1210,pemerintah kota kediri menggencarkan vaksinasi covid 19 untuk warga usia 18 tahun ke atas setelah kiriman vaksin d
1211,polda jabar kapolresta cirebon melaksanakan peninjauan vaksinasi merdeka serentak di desa keduanan depok dan desa
1212,antusiasme masyarakat ikut vaksinasi covid 19 masih tinggi vaksin sembuhkan bangsa
1213,link pendaftaran vaksinasi covid 19 dosis 1 dan 2 astrazeneca di malang 4 oktober 2021 18 tahun ke atas
1214,kejaksaan negeri kulon progo gelar vaksinasi covid 19 infopublik
1215,kabar baik tingkat kematian di dki sangat rendah dan semua yg meninggal karena covid 19 belum divaksinasi artiny
1216,penanganan pandemi covid 19 di kab samosir dengan melaksanakan vaksinasi dan giat penyekatan ops aman nusa ii tahu
1217,sukseskan vaksin untuk hentikan laju covid 19 ayo kita semua membatu pemerintah dalam mensuks
1218,penyintas covid bisa vaksin lebih cepat masker beritaterkini berita news newsupdate newsupdates covid19
1219,waspada masker palsu masker beritaterkini berita news newsupdate newsupdates covid19 covid 19 covid 19
1220,biar fakta jumlah kematian ditunjukkan dalam video ini menjawab persoalan awak nak fakta terkini pun
1221,dirbinmas polda diy kombes pol drs anjar gunadi mm melaksanakan kegiatan rapat internal yang dipimpin oleh wakap
1222,sambangi warga binaan bhabinkamtibmas desa peniraman imbau warganya untuk tetap patuhi prokes dan ikuti vaksinasi k
1223,polri sukseskan vaksin untuk hentikan laju covid 19 ayo kita semua membatu pemerintah dalam mensukses
1224,antusiasme warga suku baduy ikuti vaksinasi covid 19
1225,ayo ikut vaksinasi untuk herd immunity mencegah covid 19 vaksinpresisitnipolri vaks ncovid19 ayovaks ncovid19
1226,utk yg igg yg reaktif umumnya punya riwayat vaksinasi tapi utk yg fibrosis banyak juga yg bilang tdk menderita covid 19
1227,kapan penyintas covid bisa vaksinasi ini aturannya
1228,orang pernah positif covid 19 sudah bisa divaksin covid19 vaksinasi
1229,vaksinasi dan disiplin prokes dapat mencegah penularan varian covid 19 serta mencegah potensi lonjakan kasus positi
1230,selamatkan generasi muda bin gelar vaksinasi covid 19 untuk pelajar smp sma
1231,5 manfaat vaksinasi covid 19 yang wajib diketahui vaksin sembuhkan bangsa
1232,selamatkan generasi muda bin gelar vaksinasi covid 19 untuk pelajar smp sma masyarakat mendukung percepatan vaksi
1233,semua pegawai perkhidmatan awam persekutuan diwajibkan mengambil vaksin covid 19 dan melengkapkan vaksinasi sebelu
1234,mari kita sukseskan vaksinasi covid 19 polriadaptasikebiasaanbaru 2001 polriuntukindonesia
1235,vaksin terbukti mampu melindungi diri dari mutasi virus covid 19 vaksinasi dan disiplin prokes dapat mencegah penu
1236,antisipasi potensi lonjakan kasus dan gelombang ketiga covid 19 ini imbauan satgas vaksinasi dan disiplin prokes
1237,risiko varian mu dan pentingnya prokes untuk cegah gelombang ketiga vaksinasi dan disiplin prokes dapat mencegah p
1238,presiden jokowi apresiasi antusiasme masyarakat ikuti program vaksinasi covid 19
1239,presiden jokowi apresiasi antusiasme masyarakat ikuti program vaksinasi covid 19 mantap antusiasme masyarakat unt
1240,antusiasme masyarakat ikut vaksinasi covid 19 masih tinggi mantap antusiasme masyarakat untuk mengikuti program v
1241,vaksinasi covid 19 jangan lengah patuhi protokol kesehatan polriadaptasikebiasaanbaru 2001
1242,kepala bin vaksinasi covid 19 minimalkan risiko kematian vaksin sembuhkan bangsa
1243,krw vaksinasi ikhtiar bangsa lindungi diri dari covid 19 vaksin sembuhkan bangsa
1244,kepala bin vaksinasi covid 19 minimalkan risiko kematian vaksinasi bukan hanya semata menyelamatkan diri sendiri
1245,vaksinasi ikhtiar bangsa lindungi diri dari covid 19 vaksinasi bukan hanya semata menyelamatkan diri sendiri nam
1246,pemerintah menyediakan layanan vaksinasi covid 19 bagi official atlet dan penonton pada perhelatan peparnas xvi 20
1247,singapura masih diamuk covid 19 kini vaksin sinovac bakal jadi program vaksinasi nasional di singapura bisa untu
1248,daftar lokasi vaksinasi covid 19 dki jakarta hari ini 1 november 2021
1249,kalau lihat grafik negara2 lain yg udah ada pasca vaksinasi massal turun bentar lalu melonjak drastis
1250,penambahan kasus covid 19 pada minggu kemarin tercatat lebih dari 500 sementara kasus meninggal terdata sebanyak 1
1251,indonesia waspadai lonjakan kasus covid 19 di eropa jubir vaksinasi pertahankan testing rate
1252,presiden jokowi tegaskan proses vaksinasi covid 19 harus merata dan setara pulihkannkridenganvaksin
1253,para pemimpin negara negara g20 membahas upaya bersama untuk keluar dari krisis akibat pandemi covid 19 baik krisi
1254,vaksinasi covid 19 di kedokanbunder capai 40 persen
1255,para pemimpin di ktt g20 sepakat capai target vaksinasi global oleh who para pemimpin negara negara g20 membahas u
1256,studi vaksinasi beri perlindungan maksimal pada penyintas covid 19 cnn indonesia
1257,5 mal di tangerang sediakan vaksinasi massal covid 19 sindonews bukanberitabiasa
1258,ada pihak sedang menjual sijil vaksinasi covid palsu dengan memanipulasi mysejahtera inilah kitul zaman moden
1259,menurut epidemiolog vaksinasi amp masker lbh efektif cegah penularan covid 19 drpd test pcr amp rapid test antigen ban
1260,tarik minat vaksinasi covid 19
1261,sabtu 30 10 2021 pukul 08 00 wib sd selesai sertu noer amin babinsa ds jatitengah dan sertu agus h kopda agung ko
1262,ayo daftarkan vaksinasi covid 19 polriadaptasikebiasaanbaru 2001 polriuntukindonesia polricegahcovid19
1263,mencuci tangan sebelum dan sesudah vaksinasi covid 19 polriadaptasikebiasaanbaru 2001 polriuntukindonesia
1264,sabtu 30 10 2021 pukul 07 30 wib sd selesai sertu heryawan babinsa desa gebang beserta 2 orang anggota koramil 13
1265,selamatkan keluarga anda dari penularan covid 19 dengan mengikuti vaksinasi
1266,presiden jokowi sangat serius mengatasi pandemi covid sehingga selalu berkoordinasi dengan pemda untuk melaksanakan
1267,kita harus terus menaati protokol kesehatan prokes meski sudah vaksinasi dan angka kasus covid 19 sudah turun te
1268,memberikan himbauan disiplin penerapan protokol kesehatan dan mengajak masyarakat untuk melaksanakan vaksinasi covi
1269,update kasus covid 19 sebaran mikrozonasi pada tingkat rt dan capaian vaksinasi di kota semarang data cut off ming
1270,pam kegiatan vaksinasi covid 19 masyarskat di kantor dpd partai golkar singkawang polriadaptasikebiasaanbaru
1271,presiden jokowi menghimbau agar pemerintah daerah tetap waspada dan hati hati akan lonjakan kasus covid 19 dan sel
1272,akses vaksin belum merata di seluruh dunia menyebabkan pemulihan ekonomi tak serempak capaian vaksinasi covid 19 d
1273,bandara jfk ramai sekali ga kaya soetta tidak ada syarat test covid untuk terbang di amerika tidak ada syarat tes
1274,sampurasun sobatnet istimewa jadwal vaksinasi covid 19 di kabupaten purwakarta 1 6 november 2021 ayo di vak
1275,senin 1 11 2021 pelayanan vaksinasi covid 19 di puskesmas lebdosari
1276,vaksinasi dan disiplin prokes adalah kunci cegah penularan covid 19 apresiasi kinerja jokowimaruf
1277,jadwal vaksinasi covid 19 minggu ini senin 01 11 2021 gedung puskesmas rabu 02 11 2021 desa kalisari kamis 03 11 20
1278,vaksinasi covid 19 dosis lengkap cakup 73 2 juta penduduk
1279,dpd ldii pulau taliabu dorong warganya sukseskan percepatan vaksinasi covid 19
1280,personel satgas yonif 144 jy bersama tenaga medis puskesmas gelar vaksinasi covid 19 bagi warga perbatasan
1281,menurunnya angka covid 19 p3wni apresiasi pemerintah percepatan vaksinasi dengan catatan
1282,kapolres buol cek persiapan mtq di kecamatan lakea dan tinjau vaksinasi covid 19
1283,keberhasilan ppkm vaksinasi dan disiplin prokes dapat mencegah penularan varian covid 19
1284,siapkan 50 ribu dosis pemkab tangerang buka layanan vaksinasi covid 19 untuk masyarakat
1285,siapkan 50 ribu dosis pemkab tangerang buka layanan vaksinasi covid 19 untuk umum
1286,maizz jangan heran kalau sebagian produsen masker malah ikut bekerjasama menanamkan virus dalam
1287,koramil 0902 09 biatan gelar serbuan vaksinasi massal covid 19 dosis kedua gelombang keenam
1288,menurut dia kunci keberhasilan pemerintah indonesia menjaga kondisi saat ini antara lain kesadaran masyarakat akan
1289,3m 3t vaksinasi dan kalau diperlukan ditambah dengan 2m mengurangi mobilitas dan menghindari kerumunan ujar r
1290,jumlah penerima vaksinasi covid 19 harian pada 31 oktober 2021
1291,vaksinasi presisi tni polri sebagai upaya dalam percepatan pembentukan kekebalan kelompok demi menekan laju penular
1292,bupati sinjai andi seto asapa asa di sela sela agendanya saat memantau dua titik longsor di kecamatan sinjai bara
1293,badan intelejen negara daerah binda sulawesi barat terus menggencarkan vaksinasi covid 19 massal di berbagai daer
1294,denda akan berlaku mulai pertengahan januari tahun depan
1295,gelombang 3 covid di beberapa negara disebabkan varian baru yang bernama omicron waspada akan hal itu kita cegah
1296,cegah penyebaran covid 19 varian omicron dengan tetap selalu menjalankan disiplin prokes mendukung 3t dan vaksina
1297,update situasi covid 19 30 nov 2021 depkes telah menyelesaikan pembaruan berkala jumlah populasi kami dan meny
1298,dengan disiplin penerapan protokol kesehatan harus tetap diperkuat dan jangan sampai kendur guna mencegah kembali t
1299,munculnya varian omicron memberikan pesan kepada dunia tentang pentingnya pengontrolan transmisi covid 19 serta per
1300,pentingnya prokes dan vaksinasi untuk cegah covid 19 omicron sindonews bukanberitabiasa
1301,ayo kita bersama sama mendukung dan mensukseskan program vaksinasi covid 19
1302,kapolsek bojong berserta kanit binmas polsek bojong melaksanakan pemantauan monitoring serta menertibkan antrian pe
