,data
2657,aduh gw di vaksin moderna langsung kepala sakit setelah 2 jam suntik sudah begitu tidur nya ke bangun
2658,indonesia terima dukungan vaksin moderna dari pemerintah belanda viva
2659,mau gk mau cari vaksin booster minimal moderna atau az
2660,kasian banget vaksin ku moderna kehabisan stok mulu
2661,malah udah vaksin yg ketiga pake moderna nih tapi gapunya asuransi yg cover covid
2662,pemerintah indonesia kembali menerima vaksin corona kali ini 819 600 dosis vaksin moderna dari pemerintah belanda
2663,indonesia terima dukungan vaksin moderna dari pemerintah belanda
2664,indonesia terima 819 600 dosis vaksin moderna dari pemerintah belanda
2665,dari minggu lalu mau perawatan gigi gajadi jadi mulu sabtu lalu cuma nemenin bapa w scaling cabut gigi dan kepen
2666,pemerintah indonesia hari ini menerima 819 600 dosis vaksin moderna dari pemerintah belanda untuk mendukung penanga
2667,ya tergantung mau pake vaksin apa yang pertama bisa sinovac atau moderna gitu
2668,indonesia terima dukungan vaksin moderna dari pemerintah belanda temponasional
2669,indonesia terima 819 600 vaksin moderna dari belanda
2670,wakil presiden amerika serikat as kamala harris menerima suntikan booster vaksin covid 19 dan meminta warga ameri
2671,top 2l2 vaksin pfizer yg buat ilmuwan keturunan turki dan dikembangkan oleh perusahaan kelua
2672,sinovac ga diterima jen makanya harus karantina kalau pake az pfizer atau moderna mah g
2673,fess maju lu hee gua udh vaksin moderna
2674,dalam bentuk jadi indonesia terima 800 ribu dosis vaksin moderna dari belanda
2675,kata mama kita tidak boleh lanjut ke jenjang lebih serius hah kenapa kamu vaksinnya sinovac keluarga k
2676,kedatangan vaksin tahap ke 108
2677,ri terima 819 600 dosis vaksin moderna dari belanda
2678,huaaa demam dong abis vaksin ke 2 moderna
2679,pegel kali lengan ni abis vaksin moderna
2680,mama yang habis bedrest seminggu gegara kipi kena efek vaksin moderna itu kaya seneng bgt bisa healing ke pantai b
2681,harga minyak jatuh pada akhir perdagangan selasa atau rabu pagi wib 1 12 setelah kepala moderna meragukan kemanju
2682,bos moderna buka suara soal efektivitas vaksin harga minyak langsung anjlok
2683,seram euy kemunculan varian covid 19 b 1 1 529 atau varian omicron bikin gempar seluru
2684,ceo moderna vaksin covid 19 kurang manjur lawan omicron lengkapcepatberitanya beritaterkini international
2685,ceo moderna vaksin covid 19 kurang manjur lawan omicron universitas oxford meng
2686,ceo moderna sebut varian corona omicron kebal vaksin beritajogja jogja jogjaistimewa
2687,ceo moderna vaksin covid 19 yang tersedia kurang manjur terhadap omicron
2688,aku ga takut qrt gaib aku dah vaksin moderna dosis 2 daripada qrt gaib mending mutualan aja
2689,d 1 vaksin dosis 2 moderna gabisa tidur nyenyak kedinginan dan sering bolak balik toilet badan panas banget dan rada pusing
2690,kipi vaksin ketiga moderna ini emang beneran wow yak kemaren vaksin pertama kedua ethes aja sekarang tangan pegel
2691,check out this article pasar saham dunia jatuh setelah moderna ragukan vaksin cegah omicron
2692,coe moderna mengatakan tidak ada vaksin yang efektif terhadap omicron sedangkan dokter afrika
2693,anosmia anjjjjj padahal dah vaksin dua kali moderna
2694,berdasarkan riset yg saya alami vaksin booster moderna dosis ketiga ini efeknya cuma pegel di lengan sebelah kiri dan demam sedikit
2695,moderna mengatakan vaksin kemungkinan kurang efektif melawan omicron link agendomino
2696,ceo moderna ragukan efektivitas vaksin terhadap omicron harga emas melonjak di asia
2697,majuuu sinii jaeminnn gue udh vaksin moderna 2x
2698,pfizer dan moderna memulakan pembangunan vaksin menentang varian omicron
2699,ahli epidemiologi ui menyatakan bahwa virus omicron berbeda dengan virus corona jenis delta virus ini memiliki sist
2700,gak pernah pake masker minta vaksin moderna bukan maeennn
2701,disaat cowok rl gak mau istri kerja sesudah nikah hadirlah mas aka yg nanya mau kerja apa setelah nikah
2702,para ilmuwan di afrika selatan mengatakan mereka telah mendeteksi varian baru dengan setidaknya 10 mutasi dibanding
2703,ini disebutnya booster bukan vaksin 1 amp 2 moderna juga
2704,gawat ceo moderna sebut efektivitas vaksin turun hadapi varian omicron
2705,moderna dan pfizer siapkan vaksin khusus varian omicron klik untuk baca
2706,bos moderna sebut vaksin saat ini kesulitan lawan covid 19 varian omicron patuhiprokes
2707,bursa saham korea selatan omicron hal itu menyusul laporan financial times yang menyebut ceo moderna inc mengat
2708,sebarang vaksin yg berbentuk mrna adalah bahaya utk jangka masa panjang mcm pfizer moderna dan lain2
2709,mhn bantuan untuk vaksin ke dua jenis moderna saat ini susah di wilayah bekasi barat khususnya
2710,tadi pagi pas vaksin ke 3 moderna awalnya takut tensi soalnya begadang alhamdulillah lancar
2711,hoaxbuster salah vaksin mrna pada pfizer dan moderna berbahaya bagi anak anak selengkapnya
2712,iyasihh tp tmnku ada yg sampe meriang abis vaksin moderna
2713,turn back hoax salah vaksin mrna pada pfizer dan moderna berbahaya bagi anak anak
2714,hoax vaksin mrna pada pfizer dan moderna berbahaya bagi anak anak
2715,untuk hari junat tgl 7 januari 2022 ada laginga vaksin moderna dosis kedua
2716,hingga saat ini ada 10 vaksin yang telah mendapatkan izin penggunaan darurat dari bpom yakni sinovac coronavac a
2717,kak kalo vaksin sebelumnya sinovac terus yg booster boleh moderna ga
2718,studi vaksin booster moderna tingkatkan antibodi hingga 9 3 kali pada orang yang divaksin sinovac
2719,abis vaksin moderna
2720,selesai vaksin moderna acu tacut
2721,murica pake moderna mas tp emang lucune ki 2 highest number of case negara2 produsen vak
2722,10 vaksin covid 19 yang sudah dapatkan izin penggunaan darurat dari bpom sinovac astrazeneca sinopharm moderna
2723,vaksin sinovac astrazeneca sinopharm moderna pfizer novavax sputnik v janssen convidencia dan zifivax ini s
2724,jadwal vaksinasi covid 19 dipenghujung th 2021 dan awal th 2022 dosis 1 dan 2 jenis vaksin astrazeneca pfizer mo
2725,selamat pagi masyarakat kab tegal salam sehat selalu dipenghujung th 2021 dan awal th 2022 ayo vaksin bagi
2726,min kalo ada info vaksin moderna dosis 2 soalnya ig immuninme g ada update suwooonn min
2727,vaksin astrazeneca aja aku begini gimana vaksin moderna berasa kena covid lagi yaallah
2728,tp mulai akhir tahun ngerasa kayak diganti semua kesedihan di awal dan pertengahan tahun ngerasain dinas luar k
2729,badan pengawas obat dan makanan indonesia sudah memberikan izin penggunaan darurat pada 10 jenis vaksin covid 19 y
2730,semoga mama cepet sembuh yaa emang itu vaksinnya di atasnya moderna temen2 ku yang kerja di luar neg
2731,tamu bulanan datang bersamaan saat vaksin moderna double kill bundahhhhh
2732,mati urusan allah sdh pasti tapi syriatny harus jadi pembelajaran manusia di jepang aja tanggap ada vaksi
2733,terakhir aku liat moderna ka gatau deh kalau skrng sih blm cek td aku gabisa masuk kokas karena blm vaksin ke 2 wkwkwkw
2734,mantap dose ke4 aku sedia jadi ujikaji dos ke 4 tapi vaksin pfizer atau moderna sahaja la hahahahahahah
2735,vaksin moderna mantap bgt efeknya
2736,epidemiolog aja sudah jadi influencer ceo pfizer dan moderna nya aja pada tak mau tubuhnya dial
2737,nanti ya kalo buni udh sembuh demam panas tinggi karna kemaren vaksin ke3 moderna untung suami libur
2738,eh omicron ini beneran nakutiin anjiirrr vaksin vaksin aja performanya nurun ga cuma sinovac pfizer moderna joh
2739,cek faktanya
2740,mau sinovac astrazeneca sinopharm moderna pfizer semua vaksin yg udah dpt izin dari who dan bpom ini fungsi sa
2741,semua vaksin yang ada di indonesia baik itu sinovac astrazeneca moderna dan pfizer sudah diproses dari bahan baku
2742,semua vaksin yang ada dijamin aman untuk digunakan sobat jadi jangan pilih pilih vaksin ya sobat mau sinovac pfiz
2743,jadwal vaksin di boyolali dan sukoharjo tanggal 31 desember 2021 jenis vaksin sinovac moderna dan astrazeneca sr
2744,fyi hingga saat ini program vaksinasi di indonesia secara umum dilakukan dengan menggunakan vaksin jenis sinovac
2745,jam 9 00 vaksin dosis 3 moderna jam 10 30 langsung otw tangerang motoran dari lampung wkwk
2746,alya kk belum nemu nih tapi mau booster yg mana aja sih mestinya tetep naik ya efektivitasnya
2747,apakah serangan jantungnya krn vaksin nya moen udah ada forensik nya walau moderna memang berat sih t
2748,gak nanya dulu astrazeneca atau moderna ya soalnya efek vaksin mereka macem2
2749,scr efikasi terbukti vaksin mrna macam moderna dan pfizer lebih baik drpd sinovac efek sampi
2750,untuk yang tahun ini vaksin nya sinovac tahun depan booster moderna kata mama sy kalau vaksin yang lain gatau
2751,cuti berburu moderna krn di tag wag tyus gr2 blm vaksin
2752,infonya lur mbokmenowo isih ono jadwal vaksin dosis 2 moderna sinovac
2753,uncover infonya lur mbokmenowo isih ono jadwal vaksin dosis 2 moderna sinovac
2754,boleh rentang waktu 3 bln dr vaksin kedua pake moderna or pfizer
2755,h 1 vaksin moderna efek e msti lg muncul
2756,dokter memberi tahu kita bahwa mengonsumsi obat obatan dalam waktu bersamaan bisa berakibat fatal tetapi vaksin co
2757,mrembet ke lain temen malah cerita kalo vaksin moderna di thailand bayar sampe 3000 baht atau sekitar 1 3jt seke
2758,lemes banget asnawi kaya abis vaksin moderna
2759,eh sunu bukannya moderna ya vaksin 1 2 nya knp booster lg
2760,hai kak udh dpt vaksin ke2 moderna belom
2761,besok sama sabtu ada vaksin moderna di gedung juang tp gedung juang dimana gue gak tau
2762,0 iyaaa boosternya biasanya vaksin yg di atas sinovac astra pfizer moderna tp bisa juga booster sinovac
2763,lukas saya akui sinovac lebih baik dari moderna mertua saya udah umur 70 tahunan di vaksin sinov
2764,vaksin ke3 g3 done dapat moderna
2765,umur 7 tahun gak tau vaksin apa trakhir denger dari emaknya moderna
2766,selamat menikmati efek vaksin moderna
2767,setau saya krn dapat moderna sbg booster vaksin nakes sama sama mrna vaksin kyk pfizer selama seminggu
2768,menkes kaji vaksin moderna dan pfizer setengah dosis untuk booster
2769,vaksin moderna dosis 2 daerah solo raya dimana ya
2770,jenis vaksin yang digunakan sinovac astrazeneca moderna amp pfizer don t miss it
2771,fda berharap persetujuan resmi akan membantu mengurangi keraguan terhadap vaksin
2772,as berikan persetujuan penuh bagi vaksin corona moderna terbaru bagi berikan
2773,as berikan persetujuan penuh bagi vaksin covid 19 moderna
2774,37 jam setelah vaksin moderna masih demam pusing pegal linu untung ga mual aja
2775,isi ceramah subuh kali ini mari vaksin moderna
2776,moderna adalah vaksin kedua yang mendapatkan izin penggunaan penuh di as vaksin pertama yang mendapat izin penggun
2777,as beri izin penuh vaksin moderna untuk dewasa
2778,dokter di johns hopkins center for health security dr amesh adalja mengatakan vaksinasi penuh merupakan salah sat
2779,pak saya sudah vaksin moderna dosis 1 tapi sampai sekarang belum dapat vaksin moderna dosis ke 2 sudah m
2780,mjb kalo ak vaksinnya moderna perlu vaksin lg gasii
2781,omg no klo boleh tau vaksin apa pas booster moderna ya
2782,maaf nimbrung vaksin pfizer apa moderna
2783,h 2 vaksin booster moderna makin jadi nih demam membengkak bekas suntikan hdh
2784,varian b1 1 529 bisa lolos antibodi moderna uji vaksin booster khusus omicron m
2785,omicron bisa lolos antibodi moderna uji vaksin booster khusus moderna mengumumk
2786,sambil nunggu vaksin tuh diajak ngobrol sama cowok cowok katanya enak gue sama kakak sepupu gue dapet az nah kalo
2787,dpk klo baru di vaksin sekali gimana apa boleh vaksin kedua sy vaksin waktu itu bln september 2021 vak
2788,tadi aku udah chat sentra vaksin booster yg mau aku datangin mereka available moderna amp pfizer nanti
2789,alhamdulillah hari ini udah vaksin booster dapet moderna terpantau sampai skrg masih aman2 aja tapi bekas suntika
2790,vaksin booster moderna ngewriii broo menggigil tenan awake pateng greges
2791,hallo mau tanya apakah menyediakan vaksin moderna dan bagaimana proses vaksin untuk wna karna say
2792,vaksin moderna jahaman bat 3 hari teler gak kelar kelar
2793,booster vaksin astra bisa gasi ap mesti pfizer moderna
2794,rencananya kamis mau piknik eh rabu malah ada jadwal vaksin booster moderna yaudah cancel ga jadi healing
2795,jenis vaksin yang digunakan pfizer dan moderna atau sesuai ketentuan stok vaksin dari pemerintah harap hadir s
2796,ket jenis vaksin yang digunakan pfizer dan moderna atau sesuai ketentuan stok vaksin dari pemerintah harap h
2797,vaksin nya dari moderna sampe booster udah pernah
2798,moderna atau sesuai ketentuan stok vaksin dari pemerintah harap hadir sesuai dengan waktu yang dipilih saat pend
2799,yang vaksin 1 dan 2 pake moderna kalian vaksin ke 3 dapetnya apa
2800,keterangan jenis vaksin yang digunakan pfizer dan moderna atau sesuai ketentuan stok vaksin dari pemerintah
2801,huda11 cc tx benarkah setelah menerima suntikan vaksin
2802,iya kalo vaksin primernya az dapatnya moderna
2803,adinda iya untung aku udh booster moderna di tahun kmrn window untuk anak biasanya brp lama vaksin kedua s
2804,aku kebagian moderna suami kebagian pfizer aku 1 hari setelah vaksin kayak orang flu berat demam ringan
2805,aku yang moderna may engga sampe demam alhamdulillah soalnya habis vaksin lgsg minum paracetamol ter
2806,saya mau bertanya kalo saya lansia vaksin 1 dan 2 di amerika dan saat ini sudah lebih 6 bul
2807,sy dapat moderna malam sehabis vaksin kedinginan sakit kepala nyeri kelelahan dan kemerahan dan pemb
2808,alhamdulillah rejeki bisa dapet booster meski baru jeda 4 bulanan dari vaksin kedua moderna for booster kirain
2809,yeaahh dapet vaksin booster moderna
2810,vaksin d1 d2 sinovac mengapa tidak bisa mendapat booster moderna apakah berbahaya namun banyak temuan
2811,alhamdulillah sudah vaksin booster moderna ikhtiar sehat bismillah mi muhammadiyah dua kudus
2812,udah ada trial vaksin hiv mrna dari moderna tapi pilot project prep yang dijanjiin akhir tahun ini 2021 apa kab
2813,aku satu dua moderna itu aja sekarat takut mau vaksin lagi
2814,klonya sdh vaksin moderna 2 kali hrus ikut booster lagi kh hyung
2815,vaksin yg tipe mrna kayak pfizer sams moderna kipi nya lebih berasa nder selama ngga fatal itu gapap
2816,efek vaksin nder jangan takut soalnya rata yg pake moderna emang dibagian yg di suntik itu pegel ter
2817,widiii iya katanya sakitt mell huhu kakak aku udah soalnyaa dia moderna aduh mana aku nnti klo boos
2818,kata orang2 yg udah vaksin moderna agak ngefek walaupun pas vaksin 1 dan 2 ga kenapa kenapa oke mari kita lihat seberapa ngefek di aku
2819,kadang vaksin gak cocok memang mungkin komplikasi juga kalau vaksin moderna sering berujung demam dan
2820,moderna efek nya gimana udah vaksin ke 3 kah
2821,ambil vaksin booster apa mba saya kemarin dulu jg khawatir pas ambil moderna tp alhamdulillah cuma m
2822,vaksin pgizer dan moderna ampuh cegah covid ibu kota nusantara
2823,hamdallah bumil dan vaksin aku sudah booster moderna
2824,gak jadi vaksin anjir dulu waktu vaksin 1 itu kayaknya aku make sinovac deh kok ternyata moderna kata petugasnya
2825,vaksin pgizer dan vaksin moderna ampuh cegah covid 19 ibu kota nusantara
2826,a rie f vaksin booster opo aku bulan november kemarin pake booster moderna njut sesok e sawise vaksin booster demam 2 hari lmao
2827,vaksin moderna bkin mriyang gsk
2828,iyaa sampe gakerasa kan udh 3tahun tp skrg jadinya lebih ke biasa aja sih apalagi dulu udh pernah pos
2829,sontek vaksin moderna
2830,halo kak mau tanya jadi dibolehin ya kak sm obgyn amp petugas vaksinnya ambil az
2831,pgn jd suakrelawan vaksin hiv nya moderna deh rela gue
2832,aku 1 amp 2 dapet sinovac booster dapet moderna efeknya mantap banget serumah habis vaksin booster modern
2833,tergantung vaksin 1 2nya ka setauku sinovac vaksin ketiganya gabisa milih pfizer atau moderna deh w
2834,selain moderna enek gak sih vaksin moodbooster sumpah butuh banget
2835,efek vaksin moderna serem uyy teman gw ada yang sampai pingsan
2836,kalo sebelumnya vaksin moderna harus booster lg ga ya
2837,vaksin pfizr dan vaksin moderna ampuh cegah covid19
2838,horee udah ada notif vaksin booster di pedulilindungi gue ada info kah di jaksel yg nyediain moderna sblmnya gue az 2x
2839,gimana rasanya pasca vaksin booster moderna
2840,review booster vaksin moderna dong
2841,tf info vaksin booster di kota atau kab yg pakai moderna dong untuk umum
2842,moderna x moderna entahlah vaksin booster dapat apaan yang penting sehat aja dulu deh
2843,yang vaksin primernya moderna emang vaksin boosternya apa sih terakhir baca moderna juga tapi katanya moderna
2844,vaksin moderna 2022
2845,loc vaksin booster moderna kenapa jauh banget
2846,pengen banget vaksin sampe kayak orang sakit beneran gue dah 3x vaksin amp yg terakhir moderna b aja anjrit krn masi
2847,mencoba peruntungan vaksin booster besok neee semoga dapet beneran ya buat vaksin dr dulu emang terniat neee
2848,kak terima kasih sekali atas infonyaaa aku setelah baca langsung download dan daftar vaksin krn
2849,iya kalo moderna katanya ga perlu vaksin ke 3 lagi
2850,vaksin ke3 pgn moderna deh
2851,nahhhh kannnn qikqikqik bdw klo ada info vaksin moderna utk booster di sekitaran situ info2 yakkkk
2852,setau gue vaksin booster tuh astra moderna sama pfizer
2853,ralat ternyata vaksin yg tersedia pfizer sinpoharm dan moderna nggak ada az coba cek berkala aja di app
2854,aku dulu 1 2 moderna harus vaksin lagi ga sih
2855,nah yg repot saya nih vaksin primer moderna lihat table vaksin booster dr kemenkes hanya bs vaksin boo
2856,fyi di negara maju seperti taiwan warga yg ga mau vaksin juga ada ada teman saya satu lab yg belum vaksin sekali
2857,download aplikasi fastlab dan register di situ ada 2 pilihan lokasi tendean amp tulodong jenis vaksin pun bisa pili
2858,aku booster vaksin moderna di jaksel hari ini dan mau berbagi caranya
2859,yea i got covid 19 walau sdh vaksin booster moderna tp alhamdulillah mungkin karna sudah vaksin gejalaku ringan
2860,apakah anda bisa memberikan sitasi akan hal ini fyi di taiwan rakyat bisa memilih v
2861,info utk fasilitas kesehatan yg sedia vaksin moderna di denpasar sebelumnya saya dapat az utk vaksin 1 amp 2 thx
2862,efektivitas vaksin covid 19 turun usai 6 bulan perlindungan terbaik ditawarkan moderna republika online covid
2863,ndik tempat ku bien ae seng kudu vaksin ga gelem kabeh jauk seng pzifer lah moderna lah seng ga mau
2864,vaksin 1 2 ku az boosterku moderna wah itu ajur kipine di aku
2865,waduh vaksin booster di spark mall sold out dong sampe tanggal 3 maret info vaksin booster dong guys around jak
2866,studi menunjukkan efektivitas vaksin covid 19 menurun setelah enam bulan
2867,tf info vaksin moderna dosis ke 3 untuk umum dong guys terima kasih yang sudah menjawab
2868,halo min ada info vaksin 1 moderna ga yaa soalnya ada yg mau umrah tp blm vaksin samsek nii
2869,wal guys yg vaksin 1 amp 2 nya moderna udh bisa dapat booster nya belum
2870,eh emg knp moderna gue vaksin 1 2 nya moderna booster cm blh moderna doang
2871,halo mau tany untuk vaksin booster moderna di sana ada info sampe tgl berapanya gak
2872,awal2 ada vaksin pfizer moderna sputnik katanya cukup 1 dosis skrg malah nambah
2873,booster yang ke 3 nya bisa astra pfizer atau moderna minimal 3 bulan jarak dr vaksin ke 2
2874,ada yang punya info vaksin booster pfizer moderna di jakarta tangerang thank you
2875,kalo saya udah daftar online dulu buat antigen vaksin di sini pas daftar online mau moderna tapi kuo
2876,sorry mau nanya booster moderna di fastlab dapet berapa dosis vaksin primer kemaren sino apa az mas
2877,info vaksin booster moderna di jakarta
2878,kalo vaksin ke 1 2 moderna nanti ke 3 nya apa
2879,boosternya vaksin az apasi ges moderna ya
2880,just get moderna
2881,cah info vaksin booster moderna pfizer ning ndi yo ndek kota suwun
2882,tambah dipersulit dengan ketersediaan jenis vaksin saya harus pfizer atau moderna krn dosis 1 amp 2 nya moderna di
2883,vaksin moderna tuh ada dosis 3 nya gak si guys
2884,moderna kyknya kemarin cuma buat nakes sm lansia yg vaksin awal2 deh
2885,sekarang 3 bulan udah bisa vaksin temenku di fastlab widya chandra dapet vaksin moderna
2886,min saya vaksin 1 dan 2 moderna sudah 4 bulan yg lalu di jaki saya sudah bisa booster tapi kok ga bisa
2887,booster pakai moderna rata2 kipi nya emang diatas 12 jam post vaksin
2888,pk 01 08 wib dpt tiket booster dan langsung cari pendaftaran online yg masih bisa jaki bisa daftar tapi az berh
2889,mau info vaksin booster moderna di daerah jakarta donk tweeps udah nyari bbrapa tmpt yg ready az booster covidvaccination
2890,besok booster vaksin moderna di atlas sport center hayuk yg mau ikut
2891,mjb vaksin 1 2 ku moderna dan ga ada apa apa selain pegel di tempat suntik dan
2892,halo mau nanya dapet vaksin moderna dimana ya
2893,di malang masih ada vaksin booster pfizer moderna nggak ya
2894,tadinya mau book vaksin moderna di fastlab tapi banyak mixed review di twitter maupun di gmaps ada yg bilang mest
2895,keluar juga jadwal vaksin pfizer moderna
2896,ahaha iyaa ni msh milih mau pfizer apa moderna bingung lo vaksin 1 amp 2 nya apa
2897,info dong ges vaksin ketiga moderna dmn ya
2898,tersedia kuota hingga 500 dosis info vaksin booster moderna di atlas sport club surabaya selasa 1 maret 2022
2899,ada yang tau sentra vaksin booster yang nyediain pfizer moderna
2900,kalian ada yang tau ga vaksin booster pfizer atau moderna di jakarta dimana
2901,vaksin booster moderna di makassar dapat dimana ya
2902,vaksin booster pfizer sama moderna bagusan mana si atau sama aja
2903,gimana efek nya booster moderna setelah vaksin 1 amp 2 nya az
2904,vaksin 1 dan 2 moderna semua vaksin boosternya apa dong
2905,guys mohon info sentra vaksin tangerang pfizer moderna thanks
2906,ada info vaksin pfzier atau moderna gak jends
2907,gaes nanya donk kalau vaksin dosis 1 dan 2 dapet moderna perlu vaksin boosterkah kalau iya jenis apa moderna lagi
2908,sulitnya mencari vaksin booster yang masih menggunakan vaksin pfizer atau moderna di tangerang atau jakarta sekar
2909,pas bgt kak 2 minggu kmrn baru keluar aturan vaksin boosternya yg primarynya pfizer sama moderna
2910,endie maaf kalau xsilap saya dari apa saya baca sebelm i vaksin
2911,bagi situasi antara pfizer biontech dengan negara israel mereka memang sudah ada perjanjian untuk kongsi maklumat
2912,oo patutlah now i understand the issue with vvip vip caras queue vaccination from frontliners sbb nk pfizer jurrr
2913,pfizer melaporkan hasil uji klinis pada anak usia 12 15 tahun hasilnya vaksin ini efektif dan aman untuk menangka
2914,kabar baik pfizer klaim vaksin efektif 100 untuk anak remaja
2915,pfizer biontech menyatakan bahwa hasil uji klinis vaksin covid 19 efektif 100 persen untuk anak 12 15 tahun
2916,ops lupa vaksin pfizer pon also done for 1st and 2nd dose jkn kedah xdak hutang dah oi pantas padu ohsemm haha
2917,biontech pfizer melakukan uji coba fese 3 pada 2 260 remaja di as
2918,kabar gembira vaksin covid 19 pfizer dipastikan 100 persen efektif untuk anak usia 12 hingga 15 tahun
2919,vaksin covid pfizer aman dan efektif pada remaja
2920,biontech pfizer umum 100 keberkesanan vaksin bagi kanak kanak 12 15 tahun malaysianow
2921,pfizer dan biontech sebut vaksin covid 19 mereka aman efektif dan memproduksi respon antibodi yang kuat pada pener
2922,perusahaan mengumumkan anak anak memiliki efek samping yang mirip dengan dewasa
2923,riset baru vaksin pfizer ampuh 100 lawan covid di remaja
2924,pfizer sebut vaksin covid 19 efektif untuk anak anak berusia 12 tahun vaksin covid 19 pfizer efisien
2925,hasil uji coba fase 3 vaksin biontech pfizer diklaim 100 efektif untuk anak usia 12
2926,bakal masalah di cold chain vaksin harus disimpan dlm suhu minus 70 c
2927,vaksin covid 19 biontech pfizer diklaim 100 efektif untuk anak usia 12
2928,pfizer biontech sebut vaksinnya 100 persen efektif bagi usia 12 15 tahun pfizer biontech berencana mengajukan data
2929,pfizer klaim vaksin 100 efektif untuk anak 12 15 tahun
2930,pfizer klaim vaksin 100 persen efektif untuk anak 12 15 tahun
2931,bhdunia syarikat itu akan mendapatkan kelulusan as untuk menyuntik remaja sebelum sesi persekolahan tahun depan
2932,so far malaysia guna pfizer bg yg awal tp kes meninggal biasanya bkn sebab vaksin dan kena amb
2933,sejak layan vincenzo ni aku jadi skeptikal sikit dengan dunia ni keluar berita baru pfizer nak keluar vaksin ben
2934,ini akan mendorong program vaksinasi pertama untuk kelompok anak muda
2935,tanya kak fidah akak senior cikgu kt sekolah dia kena cucuk pfizer harap2 nanti vaksin dpt pfizer gak
2936,cara branding vaksin
2937,driver aku dapat prizer tau pfizer as a driver je and he s from india lepas amek vaksin dia pergi beli ayam g
2938,saya pening melihat kegusaran ttg az vaksin sbb pfizer pun hebat sgt dan nyata gagal elak jangkitan se
2939,nak cakap takut tapi kalau betul2 gusar bukaklah parlimen tu so that current govt ade check n balance
2940,karena kita sudah vaksin jutaan orang ya ga kaget kalau ada beberapa kasus seperti ini bt
2941,biontech kini masih menunggu hasil uji coba vaksin covid 19 yang dikembangkannya bersama pfizer pada bayi berusia e
2942,wahh smoge baik2 aje ko dpt vaksin mne pfizer ke
2943,haihh tengok kerajaan nak bagi vaksin cam tak ikhlas vaksin grad bagus cam pfizer untuk golongan bangsawan je ta
2944,itu perancangan fasa fasa pick tuan la ni kes dah gt 3k 3 hari berturut turut ni takkan nak st
2945,selain vaksin pfizer buat obat covid 19 bentuk pil agar dapat dikonsumsi di rumah
2946,adakah beliau mengambil dos ke 2 vaksin pfizer sebelum itu
2947,kurang tiga minggu sebelum memasuki gelanggang pertandingan akhir miss universe ke 69 di hollywood amerika syarika
2948,pelik la menteri ni vaksin dh dpt jenis pfizer plak tu tpi naper menteri masih xnk bersidang di parlimen naper
2949,aku bukan antivaksin tapi aku pun dah daftar untuk ambil vaksin bila nampak post pasal orang mati lepas satu dua d
2950,bagus tapi lebih bagus lagi jika seperti berita uni eropa ini beli 1 8 miliar dosis vaksin pfizer biontech tak a
2951,vaksin pfizer buatan as mulai diekspor pertama ke meksiko
